{
  "version": 1,
  "tag": "site-beta-run",
  "created_at": "2026-03-20T01:25:55.899Z",
  "session_count": 1,
  "sessions": [
    {
      "session_id": 1,
      "started_at": "2026-03-20T01:25:55.899Z",
      "ended_at": "2026-03-20T01:25:59.900Z",
      "message_count": 0
    }
  ],
  "updated_at": "2026-03-20T01:25:59.900Z",
  "current_page": "index.html"
}