{
  "version": 1,
  "tag": "site-clean-pools",
  "created_at": "2026-03-19T21:26:46.612Z",
  "session_count": 15,
  "sessions": [
    {
      "started_at": "2026-03-19T21:26:46.612Z"
    },
    {
      "started_at": "2026-03-19T21:26:48.503Z",
      "ended_at": "2026-03-19T21:27:17.439Z",
      "message_count": 0
    },
    {
      "started_at": "2026-03-19T21:27:21.519Z",
      "ended_at": "2026-03-19T23:21:59.812Z",
      "message_count": 0
    },
    {
      "started_at": "2026-03-19T23:22:00.041Z",
      "ended_at": "2026-03-19T23:23:47.722Z",
      "message_count": 0
    },
    {
      "session_id": 5,
      "started_at": "2026-03-19T23:23:56.047Z"
    },
    {
      "session_id": 6,
      "started_at": "2026-03-19T23:23:57.746Z",
      "ended_at": "2026-03-20T00:37:52.586Z",
      "message_count": 2
    },
    {
      "session_id": 7,
      "started_at": "2026-03-20T00:37:52.916Z",
      "ended_at": "2026-03-20T00:52:58.318Z",
      "message_count": 4
    },
    {
      "session_id": 8,
      "started_at": "2026-03-20T00:52:58.553Z",
      "ended_at": "2026-03-20T01:14:28.456Z",
      "message_count": 0
    },
    {
      "session_id": 9,
      "started_at": "2026-03-20T01:14:36.495Z"
    },
    {
      "session_id": 10,
      "started_at": "2026-03-20T01:14:37.037Z",
      "ended_at": "2026-03-20T01:15:08.872Z",
      "message_count": 0
    },
    {
      "session_id": 11,
      "started_at": "2026-03-20T01:15:09.126Z",
      "ended_at": "2026-03-20T01:16:20.512Z",
      "message_count": 0
    },
    {
      "session_id": 12,
      "started_at": "2026-03-20T01:16:20.708Z",
      "ended_at": "2026-03-20T01:16:27.269Z",
      "message_count": 0
    },
    {
      "session_id": 13,
      "started_at": "2026-03-20T01:34:42.171Z",
      "ended_at": "2026-03-20T01:35:37.577Z",
      "message_count": 0
    },
    {
      "session_id": 14,
      "started_at": "2026-03-20T01:35:37.719Z",
      "ended_at": "2026-03-20T01:35:50.281Z",
      "message_count": 0
    },
    {
      "session_id": 15,
      "started_at": "2026-03-20T01:46:21.706Z",
      "ended_at": "2026-03-20T01:47:14.838Z",
      "message_count": 0
    }
  ],
  "updated_at": "2026-03-20T01:47:14.838Z",
  "current_page": "gallery.html",
  "conversation_summary": "Based on the conversation, here's a concise summary:\n\n• **Typography decisions finalized**: Modern sans-serif with strong hierarchy, bold headings for confidence, and cursive lettering for elegant touches - design brief created and approved\n\n• **Missing design elements identified**: Contact page lacks cursive lettering implementation despite brief requirements, and completely missing pool cleaning images (no photos of clean pools, equipment, before/after shots, or team)\n\n• **Scope clarified**: User wants both cursive lettering and pool cleaning images added, with implementation for both mobile and desktop layouts\n\n• **Technical issues**: Site build command failing with error messages, preventing implementation of approved changes\n\n• **Next steps**: Resolve build errors, implement cursive typography elements, add pool cleaning visuals throughout the site, and ensure responsive design works on both mobile and desktop"
}