{
  "version": 1,
  "tag": "site-lawn company",
  "created_at": "2026-03-20T01:26:14.255Z",
  "session_count": 3,
  "sessions": [
    {
      "session_id": 1,
      "started_at": "2026-03-20T01:26:14.255Z",
      "ended_at": "2026-03-20T01:33:58.467Z",
      "message_count": 1
    },
    {
      "session_id": 2,
      "started_at": "2026-03-20T01:35:50.281Z"
    },
    {
      "session_id": 3,
      "started_at": "2026-03-20T18:51:28.764Z",
      "ended_at": "2026-03-20T18:51:35.839Z",
      "message_count": 0
    }
  ],
  "updated_at": "2026-03-20T18:51:35.839Z",
  "current_page": "index.html"
}